field_key,model,field_name,used_in_modules,defined_in_module,root_module,extending_modules,usage_count
account.move.name,account.move,name,"website_sale, l10n_cl_edi, account_fleet, l10n_in, csl_invoice, account_invoice_extract, sale, account_asset, l10n_latam_invoice_document, account_3way_match, l10n_it_edi, account_edi_facturx, account_reports, l10n_ar_edi, partner_commission, sale_subscription, sale_timesheet, l10n_ar, account_edi_ubl_cii, csl_account, account_taxcloud, account_debit_note, account_accountant, stock_landed_costs, l10n_it_stock_ddt, account_check_printing, account_auto_transfer, purchase, csl_purchase, l10n_cl",account,account,,51
account.journal.name,account.journal,name,"l10n_au_aba, l10n_mx, account_followup, l10n_ar, l10n_latam_invoice_document, account_bank_statement_import, account_3way_match, hr_payroll_account, hr_expense, account, account_check_printing, account_batch_payment, l10n_in, point_of_sale, account_accountant, account_reports, l10n_ar_edi, l10n_generic_auto_transfer_demo",account,account,l10n_multilang,21
res.users.groups_id,res.users,groups_id,"website_slides, hr_payroll, account_consolidation, helpdesk, hr_expense, event, hr_recruitment, hr_referral, point_of_sale, website, mrp_plm, sale, fleet, account_budget, hr_attendance, l10n_uk_reports, social, hr_timesheet, l10n_be_hr_contract_salary, hr_appraisal, quality, account_accountant, hr_contract, sign",base,base,,33
ir.module.category.name,ir.module.category,name,"sql_request_abstract, documents, marketing_automation, mrp_plm, sale_subscription, csl_project_repair, fleet, website_calendar, im_livechat, quality, sh_purchase_tags, account_accountant, lunch",base,base,,13
res.groups.name,res.groups,name,"website_slides, csl_project_repair_assignee_log, sales_team, account_consolidation, test_access_rights, helpdesk, website_calendar, hr_expense, hr_recruitment, hr_referral, point_of_sale, bista_convert_product, l10n_in, mass_mailing, website, quality_mrp, sale_stock, sql_request_abstract, mrp_plm, sale, fleet, hr_holidays, sh_purchase_multi_product_adv, sh_report_section, im_livechat, sh_purchase_tags, split_rfq, sh_base_whatsapp_integration, hr_attendance, lunch, base, social, documents, sale_subscription, sale_management, csl_account, hr_appraisal, sh_purchase_cancel, project, sh_purchase_price_history, marketing_automation, csl_project_repair, approvals, maintenance, planning, sh_purchase_custom_checklist, sh_purchase_whatsapp_integration, hr, sh_purchase_order_history, quality, account_accountant",base,base,,95
res.groups.category_id,res.groups,category_id,"website_slides, csl_project_repair_assignee_log, sales_team, account_consolidation, helpdesk, website_calendar, hr_expense, hr_recruitment, hr_referral, point_of_sale, bista_convert_product, l10n_in, mass_mailing, website, sale_stock, sql_request_abstract, mrp_plm, sale, fleet, hr_holidays, sh_purchase_multi_product_adv, sh_report_section, im_livechat, sh_purchase_tags, hr_attendance, lunch, base, social, documents, sale_subscription, sale_management, csl_account, hr_appraisal, project, sh_purchase_price_history, marketing_automation, csl_project_repair, approvals, maintenance, planning, sh_purchase_custom_checklist, hr, sh_purchase_order_history, quality, account_accountant",base,base,,90
res.groups.implied_ids,res.groups,implied_ids,"website_sale, website_slides, sales_team, account_consolidation, helpdesk, website_calendar, hr_expense, hr_recruitment, hr_referral, point_of_sale, l10n_be_edi, website_event, mass_mailing, website, quality_mrp, sql_request_abstract, mrp_plm, sale, website_hr_recruitment, fleet, hr_holidays, im_livechat, hr_attendance, lunch, printnode_base, social, documents, sale_subscription, sale_management, hr_contract_sign, mrp_workorder, csl_account, hr_appraisal, project, marketing_automation, csl_project_repair, approvals, maintenance, planning, hr_maintenance, hr, quality, l10n_be_hr_payroll_fleet, account_accountant, sale_renting_sign",base,base,,76
account.account.name,account.account,name,"account_asset, hr_payroll_account, l10n_au_keypay, account_accountant, account_disallowed_expenses",account,account,l10n_multilang,6
account.bank.statement.name,account.bank.statement,name,"account_accountant, l10n_fr_pos_cert, point_of_sale, l10n_be_coda",account,account,,4
account.move.line.name,account.move.line,name,"sale_subscription, account_asset, l10n_ar, l10n_latam_invoice_document, sale_subscription_dashboard, csl_account, account_accountant",account,account,,22
account.payment.name,account.payment,name,"l10n_au_aba, csl_account, account_check_printing, l10n_mx_edi, account_accountant",unknown,unknown,,9
digest.digest.name,digest.digest,name,"website_sale, sale_management, helpdesk, crm, digest, account, hr_recruitment, im_livechat, point_of_sale, hr_rfid, account_accountant, project",digest,digest,,14
res.partner.name,res.partner,name,"mrp_subcontracting, base_address_extended, l10n_sk, l10n_hr, helpdesk, contacts_enterprise, point_of_sale, l10n_in, website, sale_ebay, l10n_mx_edi_stock, l10n_fr_hr_payroll, sale_subscription, web_map, base_vat, l10n_gt, l10n_gr, l10n_es_edi_sii, crm, l10n_mn, l10n_id, sign, l10n_cl, l10n_pt, l10n_sa, l10n_lu, l10n_tr, sale_crm, web_mobile, l10n_co, l10n_ec, l10n_ua, base_setup, l10n_no, l10n_cr, partner_contact_access_link, l10n_de_skr03, l10n_dk, sale, l10n_lu_peppol_id, l10n_th, l10n_ph, l10n_it_edi, l10n_do, l10n_it, documents, l10n_de_reports, l10n_hk, l10n_se, l10n_au, l10n_bo, l10n_in_hr_payroll, base_geolocalize, l10n_il, l10n_es, membership, sms, partner_autocomplete, website_crm_partner_assign, l10n_lt, l10n_pl, sales_team, l10n_be, partner_contact_personal_information_page, l10n_mx, l10n_pe, l10n_be_hr_payroll, l10n_uk, pos_loyalty, l10n_cz, l10n_syscohada, sh_base_whatsapp_integration, partner_commission, csl_contacts, l10n_be_hr_contract_salary, base_iban, csl_account, product, csl_rma, project, l10n_ro, l10n_za, l10n_cn, l10n_uy, l10n_latam_base, website_customer, partner_contact_in_several_companies, l10n_nz, purchase, l10n_ae, l10n_hu, l10n_pe_edi, l10n_et, hr_payroll, website_partner, l10n_fr, l10n_de_skr04, l10n_nl, l10n_si, l10n_vn, l10n_jp, l10n_ve, l10n_ch, partner_firstname, l10n_ie, l10n_br, l10n_ar, csl_login, extra_addons, delivery_ups, l10n_in_sale, delivery, voip, account_check_printing, l10n_ca, purchase_stock, account_accountant, csl_purchase, l10n_hn",base,base,"csl_contacts, partner_firstname",205
product.template.name,product.template,name,"website_sale, website_sale_digital, csl_product, hr_expense, point_of_sale, event_sale, l10n_in, sale_product_configurator, pos_blackbox_be, mrp_plm, sale_ebay, product_email_template, sale, csl_photos, product_matrix, purchase_requisition, mrp_account_enterprise, l10n_ar_edi, website_sale_stock, sale_subscription, sale_timesheet, sale_purchase, account_taxcloud, product, industry_fsm_sale_report, csl_competitor, product_expiry, sale_stock_renting, sh_all_in_one_purchase_ex, quality_control, delivery, website_membership, sh_purchase_price_history, csl_project_repair, sale_product_matrix, sale_amazon, sale_renting, mrp_account, membership, account_accountant, purchase, sale_project, l10n_pe_edi",product,product,,82
res.config.settings.name,res.config.settings,name,"l10n_cl_edi, point_of_sale, l10n_be_hr_payroll_273S_274, onedrive, sale_purchase_inter_company_rules, l10n_in, website, website_delivery_ups, documents_hr_payroll, sale_ebay, currency_rate_live, pad_project, account_reports, l10n_fr_hr_payroll, hr_timesheet, website_sale_stock, cloud_base, sale_timesheet, delivery_dhl, web_map, base_vat, website_crm, documents_hr, project_timesheet_holidays, hr_appraisal, stock_landed_costs, csl_project_repair, l10n_es_edi_sii, crm, sale_amazon, sale_renting, digest, mail_mobile, stock_sms, lunch, bista_aws_s3_file_storage, l10n_cl, social_linkedin, social_twitter, google_drive, timesheet_grid, website_livechat, website_event, base_setup, mass_mailing, sh_all_in_one_purchase_tools, sale, stock_barcode, website_event_track, documents_account, documents_hr_recruitment, website_google_tag_manager, social, documents, l10n_it_edi_sdicoop, sale_management, account_sepa_direct_debit, sh_purchase_cancel, crm_iap_lead, documents_hr_contract, base_geolocalize, website_jitsi, switch_user_app, planning, account_sepa, delivery_bpost, hr, website_slides, sms, partner_autocomplete, website_sale, auth_password_policy, fetchmail, hr_recruitment_survey, mrp_mps, csl_compress_product_image, snailmail_account, l10n_eu_service, documents_product, l10n_mx, l10n_be_hr_payroll, auth_ldap, l10n_id_efaktur, voip_onsip, purchase_requisition, website_sale_dashboard, account_budget, hr_attendance, partner_commission, microsoft_calendar, l10n_be_hr_contract_salary, iap, delivery_fedex, l10n_cl_reports, l10n_au_keypay, account_taxcloud, product, hr_contract_salary, product_expiry, csl_rma, website_sale_coupon, project, crm_iap_lead_website, crm_iap_lead_enrich, sale_ebay_account_deletion, sh_purchase_whatsapp_integration, sale_coupon, documents_project, purchase, project_enterprise, auth_oauth, website_sale_delivery, industry_fsm, l10n_pe_edi, hr_appraisal_survey, hr_payroll, pos_adyen, google_calendar, csl_product, project_forecast, website_twitter, sale_stock, account_invoice_extract, partner_firstname, l10n_ar_edi, pos_iot, google_recaptcha, auth_signup, sale_timesheet_enterprise, delivery_easypost, mrp_workorder, l10n_be_hr_payroll_273S_274_account, web_unsplash, social_facebook, pad, sale_stock_renting, delivery_ups, delivery, sale_quotation_builder, voip, google_spreadsheet, pos_mercury, l10n_mx_edi, account_check_printing, purchase_stock, l10n_be_intrastat, account_accountant, delivery_usps, sale_renting_sign",unknown,unknown,,162
ir.cron.name,ir.cron,name,"partner_autocomplete, data_cleaning, account_followup, data_merge, l10n_lu_reports_electronic_xml_2_0, website, website_twitter, account_edi, currency_rate_live, purchase, hr_holidays, csl_attendance, partner_commission, social, base, l10n_it_edi_sdicoop, auth_signup, l10n_fr_pos_cert, payment, project, l10n_lu_saft, marketing_automation, csl_project_repair, maintenance, crm, sale_amazon, crm_iap_lead_enrich, digest, account, account_auto_transfer, l10n_lu_reports_electronic, l10n_no_saft, l10n_pe_edi",unknown,unknown,,41
ir.cron.model_id,ir.cron,model_id,"partner_autocomplete, data_cleaning, account_followup, data_merge, l10n_lu_reports_electronic_xml_2_0, website, website_twitter, account_edi, currency_rate_live, purchase, hr_holidays, csl_attendance, partner_commission, social, base, l10n_it_edi_sdicoop, auth_signup, l10n_fr_pos_cert, payment, project, l10n_lu_saft, marketing_automation, csl_project_repair, maintenance, crm, sale_amazon, crm_iap_lead_enrich, digest, account, account_auto_transfer, l10n_lu_reports_electronic, l10n_no_saft, l10n_pe_edi",unknown,unknown,,40
ir.cron.state,ir.cron,state,"partner_autocomplete, data_cleaning, account_followup, data_merge, l10n_lu_reports_electronic_xml_2_0, website, website_twitter, account_edi, currency_rate_live, purchase, hr_holidays, csl_attendance, partner_commission, social, base, l10n_it_edi_sdicoop, auth_signup, l10n_fr_pos_cert, payment, project, l10n_lu_saft, marketing_automation, csl_project_repair, maintenance, crm, sale_amazon, crm_iap_lead_enrich, digest, account, account_auto_transfer, l10n_lu_reports_electronic, l10n_no_saft, l10n_pe_edi",unknown,unknown,,40
ir.cron.code,ir.cron,code,"partner_autocomplete, data_cleaning, account_followup, data_merge, l10n_lu_reports_electronic_xml_2_0, website, website_twitter, account_edi, currency_rate_live, purchase, hr_holidays, csl_attendance, partner_commission, social, base, l10n_it_edi_sdicoop, auth_signup, l10n_fr_pos_cert, payment, project, l10n_lu_saft, marketing_automation, csl_project_repair, maintenance, crm, sale_amazon, crm_iap_lead_enrich, digest, account, account_auto_transfer, l10n_lu_reports_electronic, l10n_no_saft, l10n_pe_edi",unknown,unknown,,40
ir.cron.interval_number,ir.cron,interval_number,"partner_autocomplete, data_cleaning, account_followup, data_merge, website, website_twitter, account_edi, currency_rate_live, hr_holidays, csl_attendance, partner_commission, social, base, l10n_it_edi_sdicoop, auth_signup, l10n_fr_pos_cert, payment, marketing_automation, csl_project_repair, maintenance, crm, sale_amazon, crm_iap_lead_enrich, digest, account, account_auto_transfer, purchase, l10n_pe_edi",base,base,,34
ir.cron.interval_type,ir.cron,interval_type,"partner_autocomplete, data_cleaning, account_followup, data_merge, website, website_twitter, account_edi, currency_rate_live, hr_holidays, csl_attendance, partner_commission, social, base, l10n_it_edi_sdicoop, auth_signup, l10n_fr_pos_cert, payment, project, marketing_automation, csl_project_repair, maintenance, crm, sale_amazon, crm_iap_lead_enrich, digest, account, account_auto_transfer, purchase, l10n_pe_edi",base,base,,36
ir.cron.numbercall,ir.cron,numbercall,"partner_autocomplete, data_cleaning, account_followup, data_merge, l10n_lu_reports_electronic_xml_2_0, website, website_twitter, account_edi, currency_rate_live, hr_holidays, csl_attendance, partner_commission, social, base, l10n_it_edi_sdicoop, auth_signup, l10n_fr_pos_cert, payment, project, marketing_automation, csl_project_repair, maintenance, crm, sale_amazon, crm_iap_lead_enrich, digest, account, account_auto_transfer, purchase, l10n_pe_edi",base,base,,37
account.transfer.model.name,account.transfer.model,name,"account_auto_transfer, l10n_generic_auto_transfer_demo",account_auto_transfer,account_auto_transfer,,4
account.bank.statement.import.name,account.bank.statement.import,name,"account_bank_statement_import_qif, account_bank_statement_import_ofx, account_bank_statement_import, account_bank_statement_import_csv, l10n_be_coda, account_bank_statement_import_camt",unknown,unknown,,7
account.batch.payment.name,account.batch.payment,name,"account_batch_payment, csl_account",account_batch_payment,account_batch_payment,,6
account.analytic.account.name,account.analytic.account,name,"sale_subscription, analytic, mrp_account_enterprise, account_budget, project",analytic,analytic,l10n_multilang,9
account.disallowed.expenses.category.name,account.disallowed.expenses.category,name,"account_disallowed_expenses, account_disallowed_expenses_fleet",account_disallowed_expenses,account_disallowed_expenses,,4
fleet.vehicle.name,fleet.vehicle,name,"fleet, hr_fleet, account_disallowed_expenses_fleet, l10n_be_hr_payroll_fleet, account_fleet",fleet,fleet,,10
ir.cron.nextcall,ir.cron,nextcall,"data_cleaning, project, account_followup, sale_amazon, digest, data_merge, account, csl_attendance, partner_commission, l10n_lu_reports_electronic, l10n_no_saft, l10n_lu_saft",base,base,,14
ir.cron.doall,ir.cron,doall,"partner_autocomplete, data_cleaning, account_followup, data_merge, website_twitter, website, currency_rate_live, hr_holidays, csl_attendance, social, l10n_it_edi_sdicoop, l10n_fr_pos_cert, csl_project_repair, maintenance, crm, sale_amazon, crm_iap_lead_enrich, account, purchase",base,base,,24
mail.activity.name,mail.activity,name,"account_reports, calendar, mail",unknown,unknown,,6
account.financial.html.report.name,account.financial.html.report,name,"l10n_at_reports, l10n_es_reports, account_reports_cash_basis, l10n_ch_reports, l10n_lu_reports, l10n_no_reports, l10n_fi_reports, l10n_fr_reports, l10n_dk_reports, l10n_be_reports, l10n_mn_reports, l10n_lt_reports, l10n_in_reports",account_reports,account_reports,,27
account.fiscal.position.name,account.fiscal.position,name,"l10n_ar, account_taxcloud, csl_account",account,account,l10n_multilang,4
product.category.name,product.category,name,"csl_project_repair, csl_product, sale_renting, account_taxcloud, purchase_stock, pos_restaurant, purchase",product,product,,32
ir.module.category.description,ir.module.category,description,"documents, mrp_plm, sale_subscription, sales_team, approvals, hr_holidays, hr_expense, hr, hr_recruitment, point_of_sale, quality, mass_mailing, lunch, hr_attendance, project",base,base,,15
res.groups.comment,res.groups,comment,"csl_project_repair_assignee_log, mrp_plm, sale_subscription, sales_team, csl_project_repair, approvals, maintenance, csl_account, hr, im_livechat, quality, bista_convert_product, hr_attendance",base,base,,23
approval.category.name,approval.category,name,"approvals_purchase, approvals",approvals,approvals,,5
approval.product.line.name,approval.product.line,name,"approvals_purchase_stock, approvals_purchase, approvals",unknown,unknown,,5
approval.request.name,approval.request,name,"approvals_purchase_stock, approvals_purchase, approvals",approvals,approvals,,6
res.users.name,res.users,name,"google_calendar, csl_product, web_mobile, hr_expense, auth_totp, hr_skills, l10n_be_hr_payroll, hr_holidays, voip_onsip, ob_chatter_position, partner_firstname, hr_attendance, l10n_uk_reports, microsoft_calendar, auth_signup, csl_login, mail_github, hr_contract_sign, documents_hr, hr_fleet, hr_appraisal, auth_oauth, voip, approvals, hr_maintenance, hr_holidays_attendance, hr_org_chart, hr_contract, sign",base,base,,34
base.automation.name,base.automation,name,"base_automation, base_automation_hr_contract",unknown,unknown,,4
ir.actions.act_window.view.view_mode,ir.actions.act_window.view,view_mode,"hr_work_entry_contract, hr_payroll, website_sale, helpdesk, contacts_enterprise, hr_expense, project_forecast, sale, hr_holidays, project_timesheet_forecast, industry_fsm_sale, mrp, gamification, hr_gamification, marketing_automation_sms, partner_commission, stock, industry_fsm_report, hr_timesheet, base, sale_timesheet, mass_mailing_sms, project, google_spreadsheet, marketing_automation, planning, crm, sale_renting, membership, calendar, website_slides, contacts, project_enterprise, industry_fsm",web_cohort,base,,193
ir.actions.act_window.view.view_id,ir.actions.act_window.view,view_id,"website_sale, hr_payroll, helpdesk, contacts_enterprise, hr_expense, project_forecast, sale, hr_holidays, project_timesheet_forecast, industry_fsm_sale, mrp, gamification, hr_gamification, marketing_automation_sms, partner_commission, stock, industry_fsm_report, hr_timesheet, base, sale_timesheet, mass_mailing_sms, project, google_spreadsheet, marketing_automation, planning, crm, sale_renting, membership, calendar, website_slides, contacts, project_enterprise, industry_fsm",base,base,,179
ir.actions.act_window.view.act_window_id,ir.actions.act_window.view,act_window_id,"hr_work_entry_contract, hr_payroll, website_sale, helpdesk, contacts_enterprise, hr_expense, project_forecast, sale, hr_holidays, project_timesheet_forecast, industry_fsm_sale, mrp, gamification, hr_gamification, marketing_automation_sms, partner_commission, stock, industry_fsm_report, hr_timesheet, base, sale_timesheet, mass_mailing_sms, project, google_spreadsheet, marketing_automation, planning, crm, sale_renting, membership, calendar, website_slides, contacts, project_enterprise, industry_fsm",base,base,,193
crm.activity.report.name,crm.activity.report,name,"crm, crm_enterprise",unknown,unknown,,5
crm.lead.name,crm.lead,name,"crm_enterprise_iap_lead_website, voip_crm, crm_sms, crm_iap_lead_website, sale_crm, sale_renting_crm, crm, crm_iap_lead_enrich, crm_enterprise_partner_assign, event_crm, crm_helpdesk, crm_iap_lead, website_crm_partner_assign",crm,crm,,52
ir.cron.active,ir.cron,active,"account_edi, social, data_cleaning, crm, data_merge, website",base,base,,7
stock.picking.name,stock.picking,name,"mrp_subcontracting, stock_account, csl_sale, stock_barcode, l10n_mx_edi_stock_extended, csl_photos, l10n_mx_edi_stock, stock, website_sale_stock, purchase_by_line_routes, csl_rma, delivery_ups, quality_control, delivery, csl_project_repair, l10n_it_stock_ddt, stock_enterprise, stock_picking_batch, delivery_barcode, stock_move_location, l10n_cl_edi_stock",stock,stock,,37
delivery.carrier.name,delivery.carrier,name,"delivery_dhl, delivery_fedex, delivery_easypost, shipengine_shipping_integration_ex, delivery_bpost, website_sale_delivery, shipengine_shipping_integration, delivery_usps, delivery_ups, delivery",delivery,delivery,,14
product.packaging.name,product.packaging,name,"delivery_easypost, delivery",product,product,,3
iot.device.name,iot.device,name,"mrp_workorder_iot, delivery_iot, quality_iot, iot",iot,iot,,7
stock.picking.type.name,stock.picking.type,name,"stock_barcode, delivery_iot, mrp, csl_rma, stock_move_location, stock",stock,stock,,11
choose.delivery.package.name,choose.delivery.package,name,"delivery_iot, delivery",unknown,unknown,,2
sale.order.name,sale.order,name,"website_sale, sale_crm, sale_product_configurator, event_sale, csl_sale, sale, sale_margin, sh_report_section, shipengine_shipping_integration_ex, partner_commission, sale_subscription, sale_timesheet, sale_management, csl_rma, sale_stock_renting, l10n_in_sale, delivery_ups, delivery, sale_quotation_builder, csl_website, csl_project_repair, sale_product_matrix, sale_amazon, sale_renting, sale_account_taxcloud, sale_coupon, sale_expense, sale_renting_sign, sale_project",sale,sale,,77
res.groups.users,res.groups,users,"sales_team, helpdesk, website_calendar, hr_expense, hr_recruitment, hr_referral, point_of_sale, mass_mailing, website, sql_request_abstract, fleet, hr_holidays, im_livechat, split_rfq, hr_attendance, social, documents, sale_subscription, hr_appraisal, extra_addons, project, marketing_automation, planning, hr, lunch",base,base,,27
mail.activity.type.name,mail.activity.type,name,"documents, test_mail, mail, crm, sale_ebay_account_deletion, csl_rma, point_of_sale, product_expiry",mail,mail,,16
documents.document.name,documents.document,name,"documents, documents_spreadsheet",documents,documents,,6
res.partner.groups_id,res.partner,groups_id,"documents, sale_subscription, mrp_subcontracting, sale, csl_contacts, helpdesk, crm, product, point_of_sale, purchase, project, sign",unknown,unknown,,17
hr.employee.name,hr.employee,name,"hr_payroll, hr_expense, hr_skills, l10n_be_hr_payroll, csl_timesheet, hr_holidays, csl_attendance, hr_attendance, hr_gamification, hr_timesheet, l10n_be_hr_contract_salary, hr_presence, hr_contract_sign, documents_hr, hr_fleet, hr_appraisal, hr_attendance_kiosk_break, planning, hr_holidays_attendance, hr_maintenance, hr_org_chart, hr_contract",hr,hr,,38
hr.payroll.281.45.wizard.name,hr.payroll.281.45.wizard,name,"documents_l10n_be_hr_payroll, l10n_be_hr_payroll",unknown,unknown,,2
hr.payroll.281.10.wizard.name,hr.payroll.281.10.wizard,name,"documents_l10n_be_hr_payroll, l10n_be_hr_payroll",unknown,unknown,,2
sign.template.name,sign.template,name,"documents_sign, sign",sign,sign,,6
spreadsheet.template.name,spreadsheet.template,name,"documents_spreadsheet, documents_spreadsheet_crm, documents_spreadsheet_account",documents_spreadsheet,documents_spreadsheet,,8
spreadsheet.template.data,spreadsheet.template,data,"documents_spreadsheet_crm, documents_spreadsheet_account",documents_spreadsheet,documents_spreadsheet,,6
spreadsheet.template.thumbnail,spreadsheet.template,thumbnail,"documents_spreadsheet_crm, documents_spreadsheet_account",documents_spreadsheet,documents_spreadsheet,,6
event.event.name,event.event,name,"mass_mailing_event_track, website_event_track_gantt, website_event_track, event_enterprise, website_event_twitter_wall, website_event, mass_mailing_event, website_event_sale, event_barcode, website_event_track_social, website_event_track_exhibitor, event_crm, website_event_social, event_sale, website_event_questions",event,event,,19
event.registration.name,event.registration,name,"event_barcode, website_event_questions, event_enterprise, event_crm",event,event,,5
fleet.vehicle.cost.report.name,fleet.vehicle.cost.report,name,"fleet, fleet_dashboard",fleet,fleet,,4
helpdesk.team.name,helpdesk.team,name,"helpdesk_repair, website_helpdesk, website_helpdesk_form, website_helpdesk_forum, helpdesk, website_helpdesk_livechat, helpdesk_timesheet, helpdesk_account, helpdesk_sale_timesheet, website_helpdesk_slides, helpdesk_sale_coupon, helpdesk_stock",helpdesk,helpdesk,,18
helpdesk.team.alias_name,helpdesk.team,alias_name,"helpdesk, helpdesk_sale_timesheet",unknown,unknown,,2
helpdesk.team.use_sla,helpdesk.team,use_sla,"helpdesk, helpdesk_sale_timesheet",helpdesk,helpdesk,,3
helpdesk.stage.team_ids,helpdesk.stage,team_ids,"helpdesk, helpdesk_sale_timesheet",helpdesk,helpdesk,,7
helpdesk.stage.is_close,helpdesk.stage,is_close,"helpdesk, helpdesk_sale_timesheet",helpdesk,helpdesk,,6
helpdesk.stage.fold,helpdesk.stage,fold,"helpdesk, helpdesk_sale_timesheet",helpdesk,helpdesk,,4
ir.filters.name,ir.filters,name,"sale_timesheet, helpdesk, planning, project_timesheet_forecast, point_of_sale",base,base,,6
ir.filters.model_id,ir.filters,model_id,"sale_timesheet, helpdesk, planning, project_timesheet_forecast, point_of_sale",base,base,,6
ir.filters.context,ir.filters,context,"sale_timesheet, helpdesk, planning, project_timesheet_forecast, point_of_sale",base,base,,6
ir.filters.user_id,ir.filters,user_id,"sale_timesheet, helpdesk, planning, project_timesheet_forecast, point_of_sale",base,base,,6
helpdesk.ticket.name,helpdesk.ticket,name,"helpdesk_repair, website_helpdesk_forum, helpdesk, helpdesk_sale_timesheet_edit, helpdesk_timesheet, helpdesk_sale, helpdesk_account, helpdesk_sale_timesheet, helpdesk_sale_coupon, helpdesk_stock",helpdesk,helpdesk,,53
helpdesk.ticket.partner_id,helpdesk.ticket,partner_id,"helpdesk_repair, helpdesk",helpdesk,helpdesk,,20
helpdesk.ticket.stage_id,helpdesk.ticket,stage_id,"helpdesk_repair, helpdesk",helpdesk,helpdesk,,19
helpdesk.ticket.ticket_type_id,helpdesk.ticket,ticket_type_id,"helpdesk_repair, helpdesk, helpdesk_sale_timesheet",helpdesk,helpdesk,,20
helpdesk.ticket.team_id,helpdesk.ticket,team_id,"helpdesk_repair, helpdesk, helpdesk_sale_timesheet",helpdesk,helpdesk,,19
helpdesk.ticket.description,helpdesk.ticket,description,"helpdesk_repair, helpdesk",helpdesk,helpdesk,,18
